{
    "$schema": "https://json-schema.org/draft/2020-12/schema",
    "title": "DRAFT - FA Metadata v2.0 (NOT FOR PRODUCTION USE)",
    "description": "⚠️ WARNING: This is a DRAFT schema with breaking changes. Use v1.1 for production. This v2-draft contains property naming changes (camelCase) that are NOT backward compatible with v1.x. Combines all FA metadata sections into a single schema. Only the general and method sections are mandatory; other sections are validated when present.",
    "type": "object",
    "properties": {
        "generalSection": {
            "$ref": "./generalSection.json#/properties/generalSection"
        },
        "methodSpecific": {
            "$ref": "./methodSpecific.json#/properties/methodSpecific"
        },
        "customerSpecific": {
            "$ref": "./customerSection.json#/properties/customerSpecific"
        },
        "toolSpecific": {
            "$ref": "./toolSpecific.json#/properties/toolSpecific"
        },
        "dataEvaluation": {
            "$ref": "./dataEvaluation.json#/properties/dataEvaluation"
        },
        "history": {
            "$ref": "./historySection.json#/properties/history"
        }
    },
    "required": [
        "generalSection",
        "methodSpecific"
    ]
}