{
  "generalSection": {
    "fileName": "sample_cross_section_001.tiff",
    "timeStamp": "2025-11-13T14:25:30+01:00",
    "manufacturer": "ZEISS",
    "toolName": "GeminiSEM 500",
    "method": "SEM",
    "filePath": "/data/fa/2025-11/sample_cross_section_001.tiff",
    "fileFormat": ".tiff",
    "fileSize": {
      "value": 2097152,
      "unit": "bytes"
    },
    "imageWidth": {
      "value": 1024,
      "unit": "px"
    },
    "imageHeight": {
      "value": 768,
      "unit": "px"
    },
    "pixelWidth": {
      "value": 45.5,
      "unit": "nm"
    },
    "pixelHeight": {
      "value": 45.5,
      "unit": "nm"
    },
    "bitDepth": 8,
    "colorMode": "Grayscale",
    "serialNumber": "SEM500-2023-042",
    "customer": "Acme Semiconductor Lab",
    "toolCalibrated": true,
    "coordinates": {
      "stageCoordinateSystem": "rightHanded",
      "globalOrLocalFrame": true,
      "stagePosition": {
        "value": [
          152.3,
          84.7,
          12.5
        ],
        "unit": "mm"
      },
      "stageRotationRz": {
        "value": 0,
        "unit": "degrees"
      }
    }
  },
  "methodSpecific": {
    "scanningElectronMicroscopy": {
      "acceleratingVoltage": {
        "value": 5.0,
        "unit": "kV"
      },
      "workingDistance": {
        "value": 8.5,
        "unit": "mm"
      },
      "signalTypes": [
        "SE2",
        "InLens"
      ],
      "signalMixing": true,
      "signalProportion": [
        0.6,
        0.4
      ],
      "detectors": [
        "Everhart-Thornley",
        "InLens"
      ],
      "magnification": "5000x",
      "probeCurrent": {
        "value": 850,
        "unit": "pA"
      },
      "emissionCurrent": {
        "value": 125,
        "unit": "µA"
      },
      "brightness": [
        0.65,
        0.70
      ],
      "contrast": [
        0.55,
        0.60
      ]
    }
  },
  "dataEvaluation": {
    "imageLabel": "Die cross-section showing delamination",
    "imageId": "FA-2025-11-13-001",
    "pointsOfInterest": [
      {
        "name": "POI-1",
        "label": "Delamination",
        "id": "poi_001",
        "coordinates": {
          "value": [
            512,
            384
          ],
          "unit": "px"
        }
      },
      {
        "name": "POI-2",
        "label": "Crack initiation",
        "id": "poi_002",
        "coordinates": {
          "value": [
            650,
            420
          ],
          "unit": "px"
        }
      }
    ],
    "regionsOfInterest": {
      "polygons": [
        {
          "name": "Defect Area 1",
          "label": "Delamination zone",
          "id": "roi_poly_001",
          "coordinates": {
            "value": [
              [
                450,
                350
              ],
              [
                580,
                350
              ],
              [
                580,
                450
              ],
              [
                450,
                450
              ]
            ],
            "unit": "px"
          },
          "area": {
            "value": 350000,
            "unit": "nm²"
          },
          "fillColor": [
            1.0,
            0.0,
            0.0,
            0.3
          ],
          "strokeColor": [
            1.0,
            0.0,
            0.0
          ],
          "strokeWidth": {
            "value": 2,
            "unit": "px"
          }
        }
      ]
    }
  },
  "customerSpecific": {
    "sampleId": "WF-2025-Q4-0847",
    "orderId": "FA-REQ-112233",
    "projectId": "PROJ-ALPHA-25",
    "lotNumber": "LOT-20251101-A",
    "waferNumber": "W042",
    "dieCoordinates": {
      "x": 15,
      "y": 23
    }
  }
}